{
  "spec": "jobseal/0.0.1",
  "traveler_id": "tvl_golden0001",
  "revision": 1,
  "created_at": "2026-09-14T00:00:00.000Z",
  "buyer": { "name": "Northline Equipment" },
  "part": {
    "family": "CNC bracket",
    "part_number": "NL-BRK-4410",
    "material": { "spec": "6061-T6" },
    "qty": { "target": 50 }
  },
  "need_by": "2026-10-30",
  "incoterms": "FOB",
  "itar": false
}
